{
  "schema_version": 1,
  "id": "1.2",
  "phase": 1,
  "status": "success",
  "attempts": 1,
  "started": "2026-04-16T18:18:48Z",
  "completed": "2026-04-16T18:18:52Z",
  "last_updated": "2026-04-16T18:18:52Z",
  "outputs": [
    {
      "path": "notes.py",
      "size": 1938,
      "exists": true
    }
  ],
  "depends_on": [],
  "last_error": null,
  "plan_checksum": "sha256:66f5436ef2258f37fd9dbdf7463ed08fa99f5628a8929e60424dc9f29605c9c5"
}
