{
  "schema_version": 1,
  "id": "2.1",
  "phase": 2,
  "status": "success",
  "attempts": 1,
  "started": "2026-04-16T18:18:57Z",
  "completed": "2026-04-16T18:19:08Z",
  "last_updated": "2026-04-16T18:19:08Z",
  "outputs": [
    {
      "path": "notes.py",
      "size": 2536,
      "exists": true
    }
  ],
  "depends_on": [
    "1.1",
    "1.2"
  ],
  "last_error": null,
  "plan_checksum": "sha256:fcffaffaa16287ecd795b141f69a5a9efe6af5115b680c6d34937e70cb4b928b"
}
